{
  "$formspecDataSources": "1.0",
  "id": "https://example.gov/apps/data-aware-workspace/data-sources",
  "version": "1.0.0",
  "sources": [
    {
      "id": "query:search-results",
      "kind": "query-result",
      "owner": "module",
      "scope": "resource",
      "availability": { "level": "module", "moduleId": "x-formspec-ai-runtime" },
      "runtime": {
        "delivery": "live",
        "cache": { "mode": "snapshot" },
        "authorizationBoundary": "module",
        "failureMode": "degraded-widget",
        "provenance": { "kind": "query-result", "source": "query:workspace-search" }
      }
    }
  ]
}
