{
  "$formspecDataSources": "1.0",
  "id": "https://example.gov/apps/data-aware-workspace/data-sources",
  "version": "1.0.0",
  "sources": [
    {
      "id": "host:open-matters",
      "kind": "host-state",
      "owner": "host",
      "scope": "session",
      "availability": { "level": "app" },
      "runtime": {
        "delivery": "snapshot",
        "cache": { "mode": "snapshot" },
        "authorizationBoundary": "host",
        "failureMode": "empty-state",
        "provenance": { "kind": "host-state", "source": "host:matters.open" }
      }
    },
    {
      "id": "host:open-matters",
      "kind": "host-state",
      "owner": "host",
      "scope": "session",
      "availability": { "level": "app" },
      "runtime": {
        "delivery": "snapshot",
        "cache": { "mode": "snapshot" },
        "authorizationBoundary": "host",
        "failureMode": "empty-state",
        "provenance": { "kind": "host-state", "source": "host:matters.open.backup" }
      }
    }
  ]
}
